nombre,precio,calificacion,ciudad,check_in,check_out
Hotel Brisas La Gaviota Mariquit-Tolima,No disponible,No disponible,Mariquita,2024-12-09,2024-12-10
Domus Glamping Guatapé,No disponible,No disponible,"EL PEÑOL, GUATAPÉ",2024-12-09,2024-12-10
1714 Hotel Boutique Guatapé,No disponible,No disponible,"EL PEÑOL, GUATAPÉ",2024-12-09,2024-12-10
Hotel Spa Bliss Guatape,No disponible,No disponible,GUATAPÉ,2024-12-09,2024-12-10
Aeropuerto Rionegro- Medellin Hotel Mansión Sant Serrant,No disponible,No disponible,"MARINILLA, ANTIOQUIA",2024-12-09,2024-12-10
Hobbit Hotel Ecolodge- Guatapé,No disponible,No disponible,GUATAPÉ,2024-12-09,2024-12-10
"Cabañas Navegar- El peñol, Guatape",No disponible,No disponible,"El peñol, Guatapé",2024-12-09,2024-12-10
Hotel Omaga El peñol- Guatape,No disponible,No disponible,"EL PEÑOL, GUATAPÉ",2024-12-09,2024-12-10
Hotel Stay Guatape a dos cuadras del parque,No disponible,No disponible,GUATAPÉ,2024-12-09,2024-12-10
"San Simon Glamping,El peñol,Guatape",No disponible,No disponible,"EL PEÑOL, GUATAPÉ",2024-12-09,2024-12-10
Glamping con jacuzzi y cocina- El Peñol a 30 minutos de Guatapé,No disponible,No disponible,"EL PEÑOL, GUATAPÉ",2024-12-09,2024-12-10
Finca con jacuzzi a 15min de Guatape,No disponible,No disponible,"EL PEÑOL, GUATAPÉ",2024-12-09,2024-12-10
"Finca Parcelación Alemania 1 El peñol, Guatapé",No disponible,No disponible,"EL PEÑOL, GUATAPÉ",2024-12-09,2024-12-10
"Finca la Marina el peñol,Guatapé",No disponible,No disponible,"EL PEÑOL, GUATAPÉ",2024-12-09,2024-12-10
Hotel Castillo del lago,No disponible,No disponible,"EL PEÑOL, GUATAPÉ",2024-12-09,2024-12-10
